{
  "id": "stc-015",
  "title": "Shark attack",
  "threat": "A shark is circling the character in the ocean!",
  "choices": [
    {
      "id": "splash",
      "label": "Splash and make noise",
      "correct": false
    },
    {
      "id": "defend",
      "label": "Defend yourself with a weapon",
      "correct": true
    },
    {
      "id": "play",
      "label": "Play dead",
      "correct": false
    }
  ]
}
