{
  "id": "stc-008",
  "title": "Avalanche",
  "threat": "An avalanche is coming down the mountain!",
  "choices": [
    {
      "id": "run",
      "label": "Run straight down the mountain",
      "correct": false
    },
    {
      "id": "side",
      "label": "Move sideways to the edge",
      "correct": true
    },
    {
      "id": "dig",
      "label": "Dig into the snow",
      "correct": false
    }
  ]
}
