{
  "id": "stc-003",
  "title": "Rapid river",
  "threat": "The character is being swept away in a raging river!",
  "choices": [
    {
      "id": "swim",
      "label": "Swim toward the riverbank",
      "correct": true
    },
    {
      "id": "fight",
      "label": "Fight against the current",
      "correct": false
    },
    {
      "id": "dive",
      "label": "Dive underwater",
      "correct": false
    }
  ]
}
