{
  "id": "stc-012",
  "title": "Freezing water",
  "threat": "The character fell through ice into freezing water!",
  "choices": [
    {
      "id": "swim",
      "label": "Swim to the center of the hole",
      "correct": false
    },
    {
      "id": "kick",
      "label": "Kick and use arms to pull onto ice",
      "correct": true
    },
    {
      "id": "panic",
      "label": "Panic and thrash around",
      "correct": false
    }
  ]
}
